{"critical_bindings":{"closeout_core_sha256":"f4f4b75bc4d174c9c824d7c5fe60f2ed8a4402ec29f657ac0c8b5866c87bbfb4","custodian_cli_sha256":"04d0933fc980bb1d73d5c6d124d397e1bd7a3e9bb48a743e38d65c00aa75e1d7","review_package_config_sha256":"e9df6ad599d58e254643385dbc7db31cca70bde2e744fb7c20f47b4ff50e4673"},"evidence_boundary":{"configuration_files_copied":0,"credentials_read":false,"network_calls_made":0,"powershell_wrappers_copied":0,"prior_outputs_copied":0,"private_key_copied":false,"real_authoring_pairs_copied":0,"real_candidate_rows_copied":0,"real_label_rows_copied":0,"source_allowlist_entries":39,"source_enumeration_used":false},"files":[{"bytes":9,"path":".gitignore","role":"explicitly_allowlisted_review_source","sha256":"b09e20e217d8f87d9ee5c8afd94e2ffab33603723b336fdffaff2d0184582a75"},{"bytes":23227,"path":"README.md","role":"explicitly_allowlisted_review_source","sha256":"ab27eaa5d92fe455342473d61ee627bcd806cfd45b6f4d975be5ad8e20a1e448"},{"bytes":123433,"path":"custodian.py","role":"explicitly_allowlisted_review_source","sha256":"04d0933fc980bb1d73d5c6d124d397e1bd7a3e9bb48a743e38d65c00aa75e1d7"},{"bytes":35,"path":"requirements-review.txt","role":"explicitly_allowlisted_review_source","sha256":"ad74c6581a9dfe1bb28a7a4a601ea5790b0fa2be5c39072a7c67c3f31687812b"},{"bytes":19365,"path":"review/build_source/independent_blind_custodian_review_package_v3.py","role":"explicitly_allowlisted_review_source","sha256":"80a6f10c890fae0db452c47a7bde288c949c8048fb21d41b2db91582170936c0"},{"bytes":20466,"path":"review/build_source/test_paper_v2_independent_blind_custodian_review_package_v3.py","role":"explicitly_allowlisted_review_source","sha256":"43c3963a2c6445ef85e85e56d61bfb3b6f39db95f2ff23f434be3ef47434017f"},{"bytes":3376,"path":"review_package_config.json","role":"explicitly_allowlisted_review_source","sha256":"e9df6ad599d58e254643385dbc7db31cca70bde2e744fb7c20f47b4ff50e4673"},{"bytes":40,"path":"review_source/experiments/__init__.py","role":"generated_offline_review_support","sha256":"418e967b29b265aad14065c47ace3c40beda2584271fbebd80ca25e77aedb541"},{"bytes":40,"path":"review_source/experiments/paper_v2/__init__.py","role":"generated_offline_review_support","sha256":"418e967b29b265aad14065c47ace3c40beda2584271fbebd80ca25e77aedb541"},{"bytes":361,"path":"review_source/experiments/paper_v2/contracts.py","role":"generated_offline_review_support","sha256":"30e06a334a237f244b7c09a60d6d7998d5a5487aaef9e63c3de6d0903b572511"},{"bytes":13366,"path":"review_source/experiments/paper_v2/independent_blind_closeout_v1.py","role":"explicitly_allowlisted_review_source","sha256":"a47562ee065f3ec95633b22c4856f13244cfc44bfa1d3047b80427956ce8452a"},{"bytes":201072,"path":"review_source/experiments/paper_v2/independent_blind_closeout_v2.py","role":"explicitly_allowlisted_review_source","sha256":"f4f4b75bc4d174c9c824d7c5fe60f2ed8a4402ec29f657ac0c8b5866c87bbfb4"},{"bytes":358,"path":"review_source/protocols/paper_upgrade_v2/independent_blind_authoring_kit_v1/README.md","role":"explicitly_allowlisted_review_source","sha256":"3d2440507cf944d1d95202e580e5106b45b8a992fcfa3550982aee97f8d49ecb"},{"bytes":736,"path":"review_source/protocols/paper_upgrade_v2/independent_blind_authoring_kit_v1/case_template.json","role":"explicitly_allowlisted_review_source","sha256":"56134c42d51c8232b5a98a3ca092893878f77c715651d0567d00814c96ff16c5"},{"bytes":429,"path":"review_source/protocols/paper_upgrade_v2/independent_blind_authoring_kit_v1/custody_manifest_template.json","role":"explicitly_allowlisted_review_source","sha256":"a13715abd917e2076e79dcbffb116735392b216af45b7faa18f0f5517e103e25"},{"bytes":132116,"path":"review_source/protocols/paper_upgrade_v2/independent_blind_authoring_kit_v1/slots.jsonl","role":"explicitly_allowlisted_review_source","sha256":"4ec78a15bf87473d56d9c4a1bb59f6fadd0d8fed76adf66a567c5e794b79a0a8"},{"bytes":278,"path":"review_source/protocols/paper_upgrade_v2/independent_blind_authoring_kit_v1/status.json","role":"explicitly_allowlisted_review_source","sha256":"e9eca7bd4150f4fd20065a01f43ccf6f2660d9f47b8192a109fa0e2bb1a1ccfa"},{"bytes":1203,"path":"review_source/protocols/paper_upgrade_v2/independent_blind_authoring_kit_v2/authored_pair_template.json","role":"explicitly_allowlisted_review_source","sha256":"f81cd65512acc998d0600500cbafc5585e62c24206b9429b9c7b339662a8cd6b"},{"bytes":805,"path":"review_source/protocols/paper_upgrade_v2/independent_blind_authoring_kit_v2/case_template.json","role":"explicitly_allowlisted_review_source","sha256":"23ecfba1fac9b190fc8dd12b8e6d8ae274b84e92c0a585884b75af5c7654ca1b"},{"bytes":463,"path":"review_source/protocols/paper_upgrade_v2/independent_blind_authoring_kit_v2/content_free_output_entry_template.json","role":"explicitly_allowlisted_review_source","sha256":"312d1a393047eb563ceb34e1dd6bffc5d172c1539acddae6ab440a734ec3cfbe"},{"bytes":1103,"path":"review_source/protocols/paper_upgrade_v2/independent_blind_authoring_kit_v2/custodian_registration_template.json","role":"explicitly_allowlisted_review_source","sha256":"a55e96b5ab543a5e2b2a0bc269746cbbbd5841c0cf97f63a16e89b15eda9d70a"},{"bytes":1811,"path":"review_source/protocols/paper_upgrade_v2/independent_blind_authoring_kit_v2/custody_manifest_template.json","role":"explicitly_allowlisted_review_source","sha256":"75d566d8da93aac838c080df2c16cb780d70a9e37908b489d96e4cd129bb7fc3"},{"bytes":485,"path":"review_source/protocols/paper_upgrade_v2/independent_blind_authoring_kit_v2/effect_receipt_entry_template.json","role":"explicitly_allowlisted_review_source","sha256":"8aff4f0aa31c8201afed6721951155e453f389f3fb7dff566679d1c5d85cea3a"},{"bytes":309,"path":"review_source/protocols/paper_upgrade_v2/independent_blind_authoring_kit_v2/label_template.json","role":"explicitly_allowlisted_review_source","sha256":"e6050715202a6a9d35f89d7207cbb60dc53617d09461cd041e126a8637db5840"},{"bytes":733,"path":"review_source/protocols/paper_upgrade_v2/independent_blind_authoring_kit_v2/provider_request_chain_started_template.json","role":"explicitly_allowlisted_review_source","sha256":"417f3b88ddc45aac0b9e1416bc792fac66cb15976fe13adff42e7a4e74f43b48"},{"bytes":1079,"path":"review_source/protocols/paper_upgrade_v2/independent_blind_authoring_kit_v2/provider_request_chain_terminal_template.json","role":"explicitly_allowlisted_review_source","sha256":"0084bb6ecceace57aec1a5756b0fe4190ff4173c445deadf92a52af8ed113ee5"},{"bytes":1379,"path":"review_source/protocols/paper_upgrade_v2/independent_blind_authoring_kit_v2/provider_trace_receipt_entry_template.json","role":"explicitly_allowlisted_review_source","sha256":"3c0fc891b9cadb2dbf83df6d6b07a66f040e1945b0cbe57f8348088e3adda85d"},{"bytes":1264,"path":"review_source/protocols/paper_upgrade_v2/independent_blind_authoring_kit_v2/registration_verifier_receipt_template.json","role":"explicitly_allowlisted_review_source","sha256":"fbf7d9fa192d4cafa7708541c687ab245fb98f368f20730362f33b80d9168923"},{"bytes":1131,"path":"review_source/protocols/paper_upgrade_v2/independent_blind_authoring_kit_v2/scoring_attestation_template.json","role":"explicitly_allowlisted_review_source","sha256":"e9ee8f051c46d996dae0e770ef4652be5bfcca1b5d50a9699f0bca0ed164d2c4"},{"bytes":1640,"path":"review_source/protocols/paper_upgrade_v2/independent_blind_authoring_kit_v2/scoring_attestation_verifier_receipt_template.json","role":"explicitly_allowlisted_review_source","sha256":"6625ba671a17051f2d51c1b6354dfa62081d8ccfc6de274ee132d3c13056337c"},{"bytes":505,"path":"review_source/protocols/paper_upgrade_v2/independent_blind_authoring_kit_v2/scoring_entry_template.json","role":"explicitly_allowlisted_review_source","sha256":"608549d136b787b979f2be13dab86e3597b1f477c3f3c1770cf5769f4615b4bf"},{"bytes":2105,"path":"review_source/protocols/paper_upgrade_v2/independent_blind_authoring_kit_v2/scoring_integrity_verifier_receipt_template.json","role":"explicitly_allowlisted_review_source","sha256":"7c8286b716938a3d1cb1aa659ce95c1ef95468966dcc03bee02ae1e0bd257e3c"},{"bytes":1429,"path":"review_source/protocols/paper_upgrade_v2/independent_blind_authoring_kit_v2/signature_verifier_receipt_template.json","role":"explicitly_allowlisted_review_source","sha256":"3d09e5d1f13e1dabfd94bb73f53e510205010e549e1e7eb4d4c99bb91f1d3c89"},{"bytes":375,"path":"review_source/protocols/paper_upgrade_v2/independent_blind_authoring_kit_v2/slot_reference.json","role":"explicitly_allowlisted_review_source","sha256":"e0975c4e49d7709d9d44f4a9fbead41c147f1103220e37fb172980041b2d3e6e"},{"bytes":344,"path":"review_source/protocols/paper_upgrade_v2/independent_blind_authoring_kit_v2/status.json","role":"explicitly_allowlisted_review_source","sha256":"06a0dfa29bad015193712b3288c221d1a5d73dbdcef7960e59134b9d3e5d15cb"},{"bytes":1599,"path":"review_source/protocols/paper_upgrade_v2/independent_blind_closeout_interface_v1.json","role":"explicitly_allowlisted_review_source","sha256":"7e387c5e22161d3db760e4cfae15103c6e67dd1ffadf2e82719845710c6ccca5"},{"bytes":6080,"path":"review_source/protocols/paper_upgrade_v2/independent_blind_closeout_interface_v2.json","role":"explicitly_allowlisted_review_source","sha256":"49a2e14061dc5c4ed13ff7b50d899a2d50a3cf933e52006c3dc820f3e6d36c99"},{"bytes":919,"path":"review_source/protocols/paper_upgrade_v2/independent_blind_python_review_package_v3/offline_identity_attestation_template.txt","role":"explicitly_allowlisted_review_source","sha256":"d511d1d5c8d4bf7acc21841e144476e15f94218a9710a1a8e8af44a22cf036d4"},{"bytes":5062,"path":"review_source/tests/unit/test_paper_v2_independent_blind_closeout_v1.py","role":"explicitly_allowlisted_review_source","sha256":"f25902ffe268b2337703d0ea3d0f955cf1b771561e2ca484c13d41df929e329f"},{"bytes":4205,"path":"schemas/review_manifest_v3.schema.json","role":"explicitly_allowlisted_review_source","sha256":"995df1cad0d5290dfbeae74f8a4b3fa108d1ecab35a6ed181b508ffa6364a368"},{"bytes":5669,"path":"schemas/review_package_config.schema.json","role":"explicitly_allowlisted_review_source","sha256":"87e2ecc0cc5f1612d3a530a294c22a0868277a69ef6e8cb6